<?xml version="1.0" encoding="UTF-8"?>
<c:catalog
	xmlns:c="http://www.javacourse.by/medicins/test"
	xmlns:xsi="http://www.w3.org/2001/XMLSchema-instance"
	xsi:schemaLocation="http://www.javacourse.by/medicins src/test/resources/testData/schema.xsd ">

	<c:medicin id="m1" >
		<name>Ibuprofen</name>
		<pharm>Med Company</pharm>
		<group>group-m</group>
		<analogs>Paracetomol Noshpa</analogs>
		<version>
			<country>Israel</country>
			<certificate>1255.DF54565.1587RE</certificate>
			<data-from>2021-01</data-from>
			<data-to>2022-01</data-to>
			<pack>Pill</pack>
		</version>
		<code-cas>1235-67-8</code-cas>
		<active-substance>obezbolin</active-substance>
		<need-recipe>false</need-recipe>
	</c:medicin>

	<c:baa id="m2" out-of-prodaction="true">
		<name>Health helper</name>
		<pharm>Other Med Company</pharm>
		<group>group-a</group>
		<analogs>Gooder Weller</analogs>
		<version>
			<country>Russia</country>
			<certificate>1889.589-31.SS157</certificate>
			<data-from>2020-07</data-from>
			<data-to>2023-01</data-to>
			<pack>Gel</pack>
		</version>
		<composition>Mentol Oil</composition>
	</c:baa>

</c:catalog>
